{"schema_version":"execution-envelope.v1","envelope_id":"env-synthetic-claude","work_request_id":"wr-synthetic-read-only","plan_revision":{"id":"plan-synthetic-read","revision":1,"digest":"sha256:aaaaaaaaaaaaaaaaaaaaaaaaaaaaaaaaaaaaaaaaaaaaaaaaaaaaaaaaaaaaaaaa"},"agent_session":{"id":"session-synthetic-claude","lease_expires_at":"2026-08-24T13:00:00Z"},"issued_at":"2026-08-24T12:00:00Z","expires_at":"2026-08-24T13:00:00Z","request":{"job_ref":"job:synthetic-read-only","input_digest":"sha256:bbbbbbbbbbbbbbbbbbbbbbbbbbbbbbbbbbbbbbbbbbbbbbbbbbbbbbbbbbbbbbbb","data_class":"synthetic_only","allowed_actions":[],"declared_expectations":{"plan_step_refs":["step:synthetic-read"],"component_refs":["component:execution-fabric"],"resource_refs":["resource:worktree-a"],"component_dependencies":[]}},"server_binding":{"identity":{"organization_tenant_id":"tenant:carr-internal","sponsoring_human_id":"human:joe","agent_principal_id":"agent:synthetic","runtime_principal":"runtime:synthetic","personal_brain_scope":"brain:joe-personal","personal_brain_version":"brainver:synthetic-1","personal_rule_count":33,"derived_by":"server_identity_resolution","client_mutable":false},"authority":{"environment":"rehearsal","risk_class":"R0","capability_profile":"capability:read-only","capability_grant_ref":"grant:synthetic-claude","read_only":true,"derived_by":"server_capability_resolution","client_mutable":false},"adapter":{"surface":"claude_desktop","adapter_id":"adapter:claude-desktop","adapter_version":"v1","harness_id":"harness:claude","harness_version":"v1","provider_id":"provider:anthropic","model_id":"model:claude-synthetic","native_session_ref":"native:claude-thread-1","configuration_fingerprint":"sha256:1111111111111111111111111111111111111111111111111111111111111111"}},"handoff":{"mode":"original","replaces_agent_session_id":null,"capability_inherited":false,"checkpoint_ref":null,"native_session_transfer":"semantic_state_only"},"state_binding":{"state_version":1,"canonical_record_digest":"sha256:cccccccccccccccccccccccccccccccccccccccccccccccccccccccccccccccc","accepted_resource_revisions":[{"resource_ref":"resource:worktree-a","revision_ref":"revision:synthetic-1","digest":"sha256:dddddddddddddddddddddddddddddddddddddddddddddddddddddddddddddddd"}],"compare_and_swap_required":true},"phase_binding":{"phase_id":"phase:execution","session_affinity":"same_native_session_preferred","switch_conditions":["verified_checkpoint","phase_boundary"],"native_session_transfer":"semantic_state_only"},"evaluation_context":{"experiment_arm":"same_pair_audited_state","auditor_mode":"same_pair_auditor"}}
